{
  "$schema": "https://json-schema.org/draft/2020-12/schema",
  "title": "mq.model-route-outcome.v1",
  "type": "object",
  "additionalProperties": false,
  "required": [
    "schema",
    "decision_id",
    "task_class",
    "selected_route",
    "local_model",
    "authoritative_agent",
    "attempted",
    "model_output_received",
    "schema_valid",
    "verification",
    "accepted_by_agent",
    "accepted_by_operator",
    "escalated",
    "escalation_reason",
    "recorded_at"
  ],
  "properties": {
    "schema": {
      "const": "mq.model-route-outcome.v1"
    },
    "decision_id": {
      "type": "string",
      "minLength": 1
    },
    "run_id": {
      "description": "Identity of this routing observation. `decision_id` is a hash of the task, so repeated runs of one task share it; `run_id` keeps those runs distinguishable from duplicated records. It does not identify the enclosing execution and must never be redefined to — see `execution_run_id`.",
      "type": "string",
      "minLength": 1
    },
    "execution_run_id": {
      "description": "Identifier of the enclosing execution outcome when this routing observation occurred within an execution. Absent for standalone routing observations such as CLI shadow runs. Historical pre-correlation observations remain valid without it: absence means correlation was not recorded, not that the observation is invalid, and they are not backfilled. Distinct from `run_id`, which identifies this observation rather than the run around it.",
      "type": "string",
      "minLength": 1
    },
    "task_class": {
      "enum": [
        "diff-summary",
        "docs-review",
        "repo-health",
        "test-area-suggestions",
        "review-finding-classification",
        "context-pack-summary",
        "architecture",
        "security-review",
        "destructive-operation",
        "release-decision",
        "schema-migration",
        "unverified-change"
      ]
    },
    "selected_route": {
      "enum": [
        "local-shadow",
        "cloud-required",
        "approved-local"
      ]
    },
    "application": {
      "description": "Whether this routing decision affected a real execution. `advisory` is a recommendation only, with no model call and no run affected. `shadow` means the decision was actually evaluated and no execution was affected by the result, whether or not a run enclosed it. `applied` means the route governed a real execution. Route readiness counts `applied` and nothing else: an advisory or shadow observation is real evidence of routing behaviour and never evidence that a route was applied. Optional, so observations predating this field stay valid; absent means the mode was not recorded, not that it was advisory or shadow, and an absent value is never counted as applied. An `applied` observation must carry `execution_run_id`; that invariant is enforced by the emitter and its tests rather than by schema conditionals.",
      "enum": [
        "advisory",
        "shadow",
        "applied"
      ]
    },
    "local_model": {
      "type": [
        "string",
        "null"
      ]
    },
    "authoritative_agent": {
      "enum": [
        "codex",
        "claude"
      ]
    },
    "attempted": {
      "type": "boolean"
    },
    "model_output_received": {
      "type": "boolean"
    },
    "schema_valid": {
      "type": "boolean"
    },
    "verification": {
      "type": "object",
      "additionalProperties": false,
      "required": [
        "status",
        "checks"
      ],
      "properties": {
        "status": {
          "enum": [
            "PASS",
            "FAIL",
            "SKIPPED",
            "UNAVAILABLE"
          ]
        },
        "checks": {
          "type": "array",
          "uniqueItems": true,
          "items": {
            "type": "string",
            "minLength": 1
          }
        },
        "grounding": {
          "description": "How much of the candidate's evidence was verbatim. Optional: records predating this field carry no grounding, and its absence means unmeasured, never zero. Present so a FAIL can distinguish an invented citation from one paraphrased item out of five.",
          "type": "object",
          "additionalProperties": false,
          "required": [
            "grounded_items",
            "total_items"
          ],
          "properties": {
            "grounded_items": {
              "type": "integer",
              "minimum": 0
            },
            "total_items": {
              "type": "integer",
              "minimum": 0
            }
          }
        }
      }
    },
    "accepted_by_agent": {
      "type": "boolean"
    },
    "accepted_by_operator": {
      "type": "boolean"
    },
    "escalated": {
      "type": "boolean"
    },
    "escalation_reason": {
      "oneOf": [
        {
          "type": "null"
        },
        {
          "enum": [
            "model-unavailable",
            "schema-invalid",
            "verification-failed",
            "malformed-output",
            "policy-requires-cloud",
            "operator-required"
          ]
        }
      ]
    },
    "recorded_at": {
      "type": "string",
      "format": "date-time"
    }
  }
}
